{
  "version": "1.0.0",
  "updated": "2026-06-25",
  "lifecycle_stages": {
    "build": "Compose chains, agents, and graphs that do the work.",
    "observe": "Trace every retrieval, reasoning step, tool call, and decision.",
    "evaluate": "Score outputs against datasets and rubrics before you trust them.",
    "deploy": "Ship durable, stateful agents to production with scaling and human-in-the-loop."
  },
  "categories": [
    {
      "id": "core-ecosystem",
      "group": "ecosystem",
      "title": "Core Ecosystem",
      "description": "The four pillars you build on. LangChain gives you the components, LangGraph runs the stateful agent, Deep Agents is the batteries-included harness, and LangSmith observes and evaluates the whole thing.",
      "resources": [
        {
          "name": "LangChain (Python)",
          "url": "https://github.com/langchain-ai/langchain",
          "description": "The core framework: models, prompts, retrievers, tools, and the `create_agent` building block that everything else sits on.",
          "official": true,
          "lifecycle": ["build"]
        },
        {
          "name": "LangChain.js",
          "url": "https://github.com/langchain-ai/langchainjs",
          "description": "The TypeScript/JavaScript port of LangChain for building agents in Node and the browser.",
          "official": true,
          "lifecycle": ["build"]
        },
        {
          "name": "LangGraph (Python)",
          "url": "https://github.com/langchain-ai/langgraph",
          "description": "Low-level orchestration runtime for long-running, stateful agents. Durable execution, streaming, memory, and human-in-the-loop as first-class primitives.",
          "official": true,
          "lifecycle": ["build", "deploy"]
        },
        {
          "name": "LangGraph.js",
          "url": "https://github.com/langchain-ai/langgraphjs",
          "description": "The TypeScript implementation of the LangGraph runtime.",
          "official": true,
          "lifecycle": ["build", "deploy"]
        },
        {
          "name": "Deep Agents",
          "url": "https://github.com/langchain-ai/deepagents",
          "description": "The batteries-included agent harness on top of `create_agent`: built-in planning (write_todos), a virtual filesystem for context offloading, subagents with isolated context, and persistent memory. `pip install deepagents`.",
          "official": true,
          "lifecycle": ["build"]
        },
        {
          "name": "LangSmith",
          "url": "https://docs.smith.langchain.com/",
          "description": "Unified platform to trace, evaluate, and monitor LLM apps. The observe + evaluate half of the lifecycle, framework-agnostic.",
          "official": true,
          "lifecycle": ["observe", "evaluate"]
        },
        {
          "name": "LangGraph Platform",
          "url": "https://www.langchain.com/langgraph-platform",
          "description": "Managed deployment for LangGraph agents: horizontally scaling task queues, persistence, cron, and the Assistants API.",
          "official": true,
          "lifecycle": ["deploy"]
        },
        {
          "name": "LangChain Docs",
          "url": "https://docs.langchain.com/",
          "description": "The unified documentation hub spanning LangChain, LangGraph, Deep Agents, and LangSmith.",
          "official": true,
          "lifecycle": ["build", "observe", "evaluate", "deploy"]
        }
      ]
    },
    {
      "id": "official-tools",
      "group": "ecosystem",
      "title": "Official Tools & Prebuilt Agents",
      "description": "First-party packages and tooling from LangChain that you drop in instead of writing from scratch.",
      "resources": [
        {
          "name": "langgraph-supervisor",
          "url": "https://github.com/langchain-ai/langgraph-supervisor-py",
          "description": "Prebuilt hierarchical multi-agent pattern: a central supervisor routes work to specialized agents.",
          "official": true,
          "lifecycle": ["build"]
        },
        {
          "name": "langgraph-swarm",
          "url": "https://github.com/langchain-ai/langgraph-swarm-py",
          "description": "Prebuilt swarm pattern where agents hand off control to each other and the system remembers who was last active.",
          "official": true,
          "lifecycle": ["build"]
        },
        {
          "name": "LangMem",
          "url": "https://github.com/langchain-ai/langmem",
          "description": "Long-term memory SDK: extract, store, and retrieve semantic, episodic, and procedural memories across threads.",
          "official": true,
          "lifecycle": ["build"]
        },
        {
          "name": "LangGraph Studio",
          "url": "https://github.com/langchain-ai/langgraph-studio",
          "description": "Visual IDE to run, debug, and time-travel through your LangGraph agent's state.",
          "official": true,
          "lifecycle": ["build", "observe"]
        },
        {
          "name": "langchain-mcp-adapters",
          "url": "https://github.com/langchain-ai/langchain-mcp-adapters",
          "description": "Use any Model Context Protocol (MCP) server's tools inside LangChain and LangGraph agents.",
          "official": true,
          "lifecycle": ["build"]
        },
        {
          "name": "Agent Chat UI",
          "url": "https://github.com/langchain-ai/agent-chat-ui",
          "description": "Next.js chat front-end that talks to any LangGraph deployment out of the box, including streaming and interrupts.",
          "official": true,
          "lifecycle": ["deploy"]
        },
        {
          "name": "open-deep-research",
          "url": "https://github.com/langchain-ai/open_deep_research",
          "description": "Open, configurable deep-research agent built on LangGraph — a reference implementation for multi-step research.",
          "official": true,
          "lifecycle": ["build"]
        },
        {
          "name": "openevals",
          "url": "https://github.com/langchain-ai/openevals",
          "description": "Ready-made evaluators (LLM-as-judge, exact match, structured) for grading LLM outputs in CI and LangSmith.",
          "official": true,
          "lifecycle": ["evaluate"]
        },
        {
          "name": "agentevals",
          "url": "https://github.com/langchain-ai/agentevals",
          "description": "Evaluators specialized for agent trajectories — judge tool-call sequences and multi-step decisions, not just final answers.",
          "official": true,
          "lifecycle": ["evaluate"]
        }
      ]
    },
    {
      "id": "integrations",
      "group": "ecosystem",
      "title": "Integrations",
      "description": "The plug-in surface: model providers, vector stores, and tools that snap into LangChain via dedicated packages.",
      "resources": [
        {
          "name": "Integrations Directory",
          "url": "https://python.langchain.com/docs/integrations/providers/",
          "description": "The canonical index of every provider, vector store, retriever, and tool integration.",
          "official": true,
          "lifecycle": ["build"]
        },
        {
          "name": "langchain-anthropic",
          "url": "https://github.com/langchain-ai/langchain/tree/master/libs/partners/anthropic",
          "description": "Claude model integration (chat, tool use, prompt caching).",
          "official": true,
          "lifecycle": ["build"]
        },
        {
          "name": "langchain-openai",
          "url": "https://github.com/langchain-ai/langchain/tree/master/libs/partners/openai",
          "description": "OpenAI and Azure OpenAI chat, embeddings, and tool-calling integration.",
          "official": true,
          "lifecycle": ["build"]
        },
        {
          "name": "langchain-google-genai",
          "url": "https://github.com/langchain-ai/langchain-google",
          "description": "Google Gemini and Vertex AI model integrations.",
          "official": true,
          "lifecycle": ["build"]
        },
        {
          "name": "langchain-aws",
          "url": "https://github.com/langchain-ai/langchain-aws",
          "description": "Amazon Bedrock models, Kendra retrieval, and other AWS integrations.",
          "official": true,
          "lifecycle": ["build"]
        },
        {
          "name": "langchain-chroma",
          "url": "https://github.com/langchain-ai/langchain-chroma",
          "description": "Chroma vector store integration for local and embedded RAG.",
          "official": true,
          "lifecycle": ["build"]
        },
        {
          "name": "langchain-postgres (pgvector)",
          "url": "https://github.com/langchain-ai/langchain-postgres",
          "description": "Postgres + pgvector vector store and chat-history store.",
          "official": true,
          "lifecycle": ["build"]
        },
        {
          "name": "Tavily Search",
          "url": "https://github.com/tavily-ai/langchain-tavily",
          "description": "Search API built for agents; a common web-retrieval tool in LangGraph research agents.",
          "official": false,
          "lifecycle": ["build"]
        }
      ]
    },
    {
      "id": "templates",
      "group": "ecosystem",
      "title": "Templates & Starters",
      "description": "Clone-and-go starting points. Most are LangGraph templates wired for LangGraph Studio and Platform.",
      "resources": [
        {
          "name": "ReAct Agent Template",
          "url": "https://github.com/langchain-ai/react-agent",
          "description": "The canonical tool-calling agent template — the fastest way to a working LangGraph agent.",
          "official": true,
          "lifecycle": ["build"]
        },
        {
          "name": "Retrieval Agent Template",
          "url": "https://github.com/langchain-ai/retrieval-agent-template",